{
  "algorithm_info": {
    "name": "Sum of Distances in Tree",
    "family": "graph_search",
    "data_type": "graph"
  },
  "layout_strategy": {
    "main_view": {
      "type": "force_directed",
      "params": {
        "node_spacing": 3.5,
        "edge_curve": 0.2
      }
    },
    "auxiliary_views": {
      "position": "left",
      "max_width": 0.3,
      "vertical_spacing": 0.2
    },
    "pseudocode": {
      "position": "top-left",
      "font_size": 14,
      "max_lines": 24
    }
  },
  "style_overrides": {
    "color_scheme": {
      "background": "#1E1E1E",
      "text": "#FFFFFF",
      "primary": "#4EC9B0",
      "secondary": "#569CD6",
      "accent": "#CE9178"
    },
    "element_styles": {},
    "animation_timing": {
      "transition": 0.8,
      "pause": 0.3,
      "node_highlight": 0.3,
      "edge_update": 0.4,
      "cell_update": 0.3,
      "array_swap": 0.5
    }
  },
  "visual_enhancements": {
    "custom_annotations": [
      {
        "frame": 0,
        "type": "text",
        "label": "Sum of Distances in Tree Algorithm",
        "color": "#4EC9B0",
        "position": [
          0,
          2
        ]
      },
      {
        "frame": 10,
        "type": "text",
        "label": "Initializing node distances",
        "color": "#569CD6",
        "position": [
          0,
          1.5
        ]
      },
      {
        "frame": 35,
        "type": "text",
        "label": "Processing tree traversal",
        "color": "#CE9178",
        "position": [
          0,
          1.5
        ]
      },
      {
        "frame": 60,
        "type": "text",
        "label": "Final distance calculation",
        "color": "#4EC9B0",
        "position": [
          0,
          1.5
        ]
      }
    ]
  }
}